{
  "schema_version": "1.0",
  "generated_at": "2026-02-12T23:11:05.447955+00:00",
  "scenario_id": "demo6_transient_emitter",
  "band": "c_1550",
  "wavelength_nm": 1550,
  "inputs": {
    "source": {
      "type": "emitter_cavity",
      "physics_backend": "analytic",
      "emission_mode": "transient",
      "transient_steps": 64,
      "rep_rate_mhz": 120,
      "collection_efficiency": 0.36,
      "coupling_efficiency": 0.62,
      "radiative_lifetime_ns": 1.0,
      "purcell_factor": 5,
      "dephasing_rate_per_ns": 0.5,
      "g2_0": 0.02,
      "drive_strength": 0.1,
      "pulse_window_ns": 5.0
    },
    "channel": {
      "model": "fiber",
      "fiber_loss_db_per_km": 0.2,
      "connector_loss_db": 1.5,
      "dispersion_ps_per_km": 5,
      "distance_km": 0.0
    },
    "detector": {
      "class": "snspd",
      "pde": 0.3,
      "dark_counts_cps": 100,
      "jitter_ps_fwhm": 30,
      "dead_time_ns": 100,
      "afterpulsing_prob": 0.001,
      "physics_backend": "analytic",
      "sample_count": 500,
      "time_bin_ps": 10.0,
      "afterpulse_delay_ns": 50.0
    },
    "timing": {
      "sync_drift_ps_rms": 10,
      "coincidence_window_ps": 200
    },
    "protocol": {
      "name": "BBM92",
      "sifting_factor": 0.5,
      "ec_efficiency": 1.16
    }
  },
  "derived": {
    "loss_budget": {
      "fiber_loss_db": 0.0,
      "connector_loss_db": 1.5,
      "total_loss_db": 1.5
    },
    "timing_budget": {
      "effective_jitter_ps": 30,
      "false_herald_prob": 2.002e-08
    },
    "multiphoton": {
      "p_multi": 0.016493997596752928,
      "qber_contrib": 8.796895776817284
    },
    "dark_counts": {
      "qber_contrib": 1.0677451140562338e-05
    },
    "timing_errors": {
      "qber_contrib": 1.0666784356206132e-05
    },
    "qber_total": 0.5
  },
  "outputs": {
    "entanglement_rate_hz": 219935.12922493587,
    "key_rate_bps": 0.0,
    "fidelity_est": 0.5,
    "critical_distance_km": 0.0,
    "uncertainty": {
      "key_rate_ci_low": 0.0,
      "key_rate_ci_high": 0.0,
      "outage_probability": 1.0
    }
  },
  "error_budget": {
    "dominant_error": "multiphoton",
    "error_budget": {
      "loss_fraction": 0.03213281292213955,
      "detector_fraction": 1.1747700311788986e-06,
      "multiphoton_fraction": 0.9678648387113945,
      "timing_fraction": 1.1735964347441547e-06
    }
  },
  "safe_use_label": {
    "label": "qualitative",
    "rationale": "QBER or key rate exceeds security threshold."
  },
  "reproducibility": {
    "config_hash": "8a484f9b5bd57e356feb799729889e7353a9412e37ca616f3893d935fa13c89f",
    "model_hash": null,
    "seed": 0
  },
  "artifacts": {
    "plots": {},
    "report_html_path": "results\\demo6_transient_emitter\\demo6_transient_emitter\\c_1550\\report.html",
    "report_pdf_path": null,
    "card_path": "/mnt/c/Users/aksin/Desktop/Qutip+qskit projects/photonstrust/results/release_bundle/demo6_transient_emitter/c_1550/reliability_card.json",
    "results_path": "/mnt/c/Users/aksin/Desktop/Qutip+qskit projects/photonstrust/results/release_bundle/demo6_transient_emitter/c_1550/results.json"
  }
}