{
  "schema_version": "1.0",
  "generated_at": "2026-02-12T23:22:11.901298+00:00",
  "scenario_id": "demo7_multifidelity_certification",
  "band": "c_1550",
  "wavelength_nm": 1550,
  "evidence_quality_tier": "simulated_only",
  "benchmark_coverage": "internal_demo",
  "calibration_diagnostics": {
    "status": "not_calibrated",
    "gate_pass": false
  },
  "reproducibility_artifact_uri": null,
  "inputs": {
    "source": {
      "type": "emitter_cavity",
      "physics_backend": "analytic",
      "rep_rate_mhz": 100,
      "collection_efficiency": 0.35,
      "coupling_efficiency": 0.6,
      "radiative_lifetime_ns": 1.0,
      "purcell_factor": 5,
      "dephasing_rate_per_ns": 0.5,
      "g2_0": 0.02,
      "drive_strength": 0.05,
      "pulse_window_ns": 5.0,
      "emission_mode": "steady_state",
      "transient_steps": 64
    },
    "channel": {
      "model": "fiber",
      "fiber_loss_db_per_km": 0.2,
      "connector_loss_db": 1.5,
      "dispersion_ps_per_km": 5,
      "distance_km": 0.0
    },
    "detector": {
      "class": "snspd",
      "physics_backend": "stochastic",
      "sample_count": 400,
      "seed": 17,
      "time_bin_ps": 10.0,
      "afterpulse_delay_ns": 50.0,
      "pde": 0.3,
      "dark_counts_cps": 100,
      "jitter_ps_fwhm": 30,
      "dead_time_ns": 100,
      "afterpulsing_prob": 0.001
    },
    "timing": {
      "sync_drift_ps_rms": 10,
      "coincidence_window_ps": 200
    },
    "protocol": {
      "name": "BBM92",
      "sifting_factor": 0.5,
      "ec_efficiency": 1.16
    }
  },
  "derived": {
    "loss_budget": {
      "fiber_loss_db": 0.0,
      "connector_loss_db": 1.5,
      "total_loss_db": 1.5
    },
    "timing_budget": {
      "effective_jitter_ps": 30,
      "false_herald_prob": 2e-08
    },
    "multiphoton": {
      "p_multi": 0.0196078431372549,
      "qber_contrib": 10.054128763579493
    },
    "dark_counts": {
      "qber_contrib": 1.0255211338851083e-05
    },
    "timing_errors": {
      "qber_contrib": 1.0255211338851083e-05
    },
    "qber_total": 0.5
  },
  "outputs": {
    "entanglement_rate_hz": 191219.40794666312,
    "key_rate_bps": 0.0,
    "fidelity_est": 0.5,
    "critical_distance_km": 0.0,
    "uncertainty": {
      "key_rate_ci_low": 0.0,
      "key_rate_ci_high": 0.0,
      "outage_probability": 1.0
    }
  },
  "error_budget": {
    "dominant_error": "multiphoton",
    "error_budget": {
      "loss_fraction": 0.028228153052366103,
      "detector_fraction": 9.912052618278526e-07,
      "multiphoton_fraction": 0.9717698645371103,
      "timing_fraction": 9.912052618278526e-07
    }
  },
  "safe_use_label": {
    "label": "qualitative",
    "rationale": "QBER or key rate exceeds security threshold."
  },
  "reproducibility": {
    "config_hash": "9fc132d5344e372731a2931c9d49a8be9474fa25966894c1c127c4ab95fc21af",
    "model_hash": null,
    "seed": 0
  },
  "artifacts": {
    "plots": {},
    "report_html_path": "results\\demo7_certification\\demo7_multifidelity_certification\\c_1550\\report.html",
    "report_pdf_path": null,
    "card_path": "results\\demo7_certification\\demo7_multifidelity_certification\\c_1550\\reliability_card.json"
  }
}